{
  "id": "signal-noir",
  "version": "1.0.0",
  "tokens": {
    "background": "#18212a",
    "ink": "#edf2f6",
    "captionInk": "#ffffff",
    "muted": "#a8c3d7",
    "accent": "#f1b85b",
    "accentAlt": "#75b6e7",
    "paper": "#202e3b",
    "grid": "#314553",
    "displayFont": "Arial, \"PingFang SC\", \"Noto Sans CJK SC\", \"Microsoft YaHei\", sans-serif",
    "bodyFont": "Arial, \"PingFang SC\", \"Noto Sans CJK SC\", \"Microsoft YaHei\", sans-serif",
    "pattern": "grid",
    "surfaceRadius": 0,
    "surfaceBorder": "1px solid #75b6e7",
    "surfaceShadow": "none",
    "labelRadius": 4,
    "titleFontSize": 116
  },
  "safeArea": {
    "landscape": {
      "top": 84,
      "right": 104,
      "bottom": 88,
      "left": 104
    },
    "portrait": {
      "top": 132,
      "right": 70,
      "bottom": 140,
      "left": 70
    }
  },
  "supports": {
    "purposes": [
      "opening",
      "claim",
      "process",
      "evidence",
      "media",
      "closing"
    ],
    "templates": [
      "statement",
      "graph-explainer",
      "metric-grid",
      "interaction-flow"
    ],
    "layers": [
      "label",
      "card",
      "annotation",
      "metric",
      "node",
      "screenshot",
      "object",
      "callout"
    ],
    "actions": [
      "enter",
      "reveal",
      "draw",
      "focus",
      "highlight",
      "count",
      "camera-push",
      "rotate",
      "set-state"
    ],
    "transitions": [
      "fade",
      "slide",
      "paper-wipe",
      "carry"
    ],
    "overlapTransitions": [
      "overlap-fade",
      "overlap-slide",
      "overlap-carry"
    ]
  },
  "provenance": {
    "fonts": "System Arial / PingFang SC / Microsoft YaHei or installed Noto Sans CJK SC; no fonts bundled.",
    "assets": "CSS-only layout chrome; media is supplied by the storyboard and must be recorded in its asset manifest."
  }
}
